{
  "requirement_title": "商品搜索接口断言",
  "test_essence": "验证导航缺口和接口字段断言契约",
  "unmatched_count": 0,
  "schema_version": "6.0",
  "test_points": [
    {
      "id": "TP-001",
      "title": "搜索全部类别商品",
      "priority": "P0",
      "module_l1": "销售",
      "module_l2": "销售开单",
      "module_match": "matched",
      "product_tags": ["ailit"],
      "version_tags": ["单店版"],
      "platform_tags": ["APP端"],
      "source_rp_ids": ["RP-001"],
      "technical_refs": [
        {
          "type": "backend_api",
          "platform": "app",
          "page_id": "商品选择页",
          "element_name": "顶部.搜索框",
          "method": "GET",
          "target": "/v1/baseinfo/product/query/list",
          "operation": "查询全部类别商品",
          "kb_ref": "DF-064",
          "assertions": [
            {
              "location": "body",
              "json_path": "$.data.list",
              "operator": "contains",
              "expected": "{test_data.product_b}"
            },
            {
              "location": "body",
              "json_path": "$.data.list",
              "operator": "unique"
            }
          ]
        }
      ]
    }
  ],
  "merge_report": {
    "rules_applied": [],
    "entries": [],
    "path_gaps": [
      {
        "tp_id": "TP-001",
        "page_id": "商品选择页",
        "element_name": "顶部.搜索框",
        "platform": "app",
        "reason": "kb_and_requirement_path_missing"
      }
    ],
    "api_assertion_gaps": [
      {
        "tp_id": "TP-001",
        "technical_ref_index": 0,
        "missing_fields": ["expected"],
        "reason": "assertion_expected_missing"
      }
    ]
  }
}
